{
  "worksheet": "WS5",
  "curriculum_status": "deployed",
  "pipeline_stage": "extraction_only",
  "interpretation_prohibited": true,
  "ocr_engine": "claude_vision",
  "source_type": "worksheet",
  "note": "Twenty-five table cells (B1–B25) plus six aggregate row keys.",
  "fields": [
    {
      "field_id": "WS5_B1",
      "rubric_item_id": "WS5_row1",
      "type": "table_cell",
      "required": true,
      "location_hint": "Printed question 1 — WS5 worksheet response region",
      "printed_blank": 1,
      "scoring_mode": "computed",
      "scored": true,
      "scoring_item_id": "WS5_row1",
      "cell_role": "threshold"
    },
    {
      "field_id": "WS5_B10",
      "rubric_item_id": "WS5_row3",
      "type": "table_cell",
      "required": true,
      "location_hint": "Printed question 10 — WS5 worksheet response region",
      "printed_blank": 10,
      "scoring_mode": "computed",
      "scored": true,
      "scoring_item_id": "WS5_row3",
      "cell_role": "correct"
    },
    {
      "field_id": "WS5_B11",
      "rubric_item_id": "WS5_row3",
      "type": "table_cell",
      "required": true,
      "location_hint": "Printed question 11 — WS5 worksheet response region",
      "printed_blank": 11,
      "scoring_mode": "computed",
      "scored": true,
      "scoring_item_id": "WS5_row3",
      "cell_role": "errors"
    },
    {
      "field_id": "WS5_B12",
      "rubric_item_id": "WS5_row3",
      "type": "table_cell",
      "required": true,
      "location_hint": "Printed question 12 — WS5 worksheet response region",
      "printed_blank": 12,
      "scoring_mode": "computed",
      "scored": true,
      "scoring_item_id": "WS5_row3",
      "cell_role": "mcr"
    },
    {
      "field_id": "WS5_B13",
      "rubric_item_id": "WS5_row4",
      "type": "table_cell",
      "required": true,
      "location_hint": "Printed question 13 — WS5 worksheet response region",
      "printed_blank": 13,
      "scoring_mode": "computed",
      "scored": true,
      "scoring_item_id": "WS5_row4",
      "cell_role": "threshold"
    },
    {
      "field_id": "WS5_B14",
      "rubric_item_id": "WS5_row4",
      "type": "table_cell",
      "required": true,
      "location_hint": "Printed question 14 — WS5 worksheet response region",
      "printed_blank": 14,
      "scoring_mode": "computed",
      "scored": true,
      "scoring_item_id": "WS5_row4",
      "cell_role": "correct"
    },
    {
      "field_id": "WS5_B15",
      "rubric_item_id": "WS5_row4",
      "type": "table_cell",
      "required": true,
      "location_hint": "Printed question 15 — WS5 worksheet response region",
      "printed_blank": 15,
      "scoring_mode": "computed",
      "scored": true,
      "scoring_item_id": "WS5_row4",
      "cell_role": "errors"
    },
    {
      "field_id": "WS5_B16",
      "rubric_item_id": "WS5_row4",
      "type": "table_cell",
      "required": true,
      "location_hint": "Printed question 16 — WS5 worksheet response region",
      "printed_blank": 16,
      "scoring_mode": "computed",
      "scored": true,
      "scoring_item_id": "WS5_row4",
      "cell_role": "mcr"
    },
    {
      "field_id": "WS5_B17",
      "rubric_item_id": "WS5_row5",
      "type": "table_cell",
      "required": true,
      "location_hint": "Printed question 17 — WS5 worksheet response region",
      "printed_blank": 17,
      "scoring_mode": "computed",
      "scored": true,
      "scoring_item_id": "WS5_row5",
      "cell_role": "threshold"
    },
    {
      "field_id": "WS5_B18",
      "rubric_item_id": "WS5_row5",
      "type": "table_cell",
      "required": true,
      "location_hint": "Printed question 18 — WS5 worksheet response region",
      "printed_blank": 18,
      "scoring_mode": "computed",
      "scored": true,
      "scoring_item_id": "WS5_row5",
      "cell_role": "correct"
    },
    {
      "field_id": "WS5_B19",
      "rubric_item_id": "WS5_row5",
      "type": "table_cell",
      "required": true,
      "location_hint": "Printed question 19 — WS5 worksheet response region",
      "printed_blank": 19,
      "scoring_mode": "computed",
      "scored": true,
      "scoring_item_id": "WS5_row5",
      "cell_role": "errors"
    },
    {
      "field_id": "WS5_B2",
      "rubric_item_id": "WS5_row1",
      "type": "table_cell",
      "required": true,
      "location_hint": "Printed question 2 — WS5 worksheet response region",
      "printed_blank": 2,
      "scoring_mode": "computed",
      "scored": true,
      "scoring_item_id": "WS5_row1",
      "cell_role": "correct"
    },
    {
      "field_id": "WS5_B20",
      "rubric_item_id": "WS5_row5",
      "type": "table_cell",
      "required": true,
      "location_hint": "Printed question 20 — WS5 worksheet response region",
      "printed_blank": 20,
      "scoring_mode": "computed",
      "scored": true,
      "scoring_item_id": "WS5_row5",
      "cell_role": "mcr"
    },
    {
      "field_id": "WS5_B21",
      "type": "table_cell",
      "required": true,
      "location_hint": "Printed question 21 — WS5 worksheet response region",
      "printed_blank": 21,
      "scoring_mode": "computed",
      "scored": false,
      "scoring_item_id": "WS5_row6",
      "cell_role": "threshold"
    },
    {
      "field_id": "WS5_B22",
      "type": "table_cell",
      "required": true,
      "location_hint": "Printed question 22 — WS5 worksheet response region",
      "printed_blank": 22,
      "scoring_mode": "computed",
      "scored": false,
      "scoring_item_id": "WS5_row6",
      "cell_role": "correct"
    },
    {
      "field_id": "WS5_B23",
      "type": "table_cell",
      "required": true,
      "location_hint": "Printed question 23 — WS5 worksheet response region",
      "printed_blank": 23,
      "scoring_mode": "computed",
      "scored": false,
      "scoring_item_id": "WS5_row6",
      "cell_role": "errors"
    },
    {
      "field_id": "WS5_B24",
      "type": "table_cell",
      "required": true,
      "location_hint": "Printed question 24 — WS5 worksheet response region",
      "printed_blank": 24,
      "scoring_mode": "computed",
      "scored": false,
      "scoring_item_id": "WS5_row6",
      "cell_role": "mcr"
    },
    {
      "field_id": "WS5_B25",
      "rubric_item_id": "WS5_B25",
      "type": "free_text",
      "required": true,
      "location_hint": "Printed question 25 — WS5 worksheet response region",
      "printed_blank": 25,
      "scoring_mode": "computed",
      "scored": true,
      "scoring_item_id": "WS5_B25",
      "cell_role": "final_choice"
    },
    {
      "field_id": "WS5_B3",
      "rubric_item_id": "WS5_row1",
      "type": "table_cell",
      "required": true,
      "location_hint": "Printed question 3 — WS5 worksheet response region",
      "printed_blank": 3,
      "scoring_mode": "computed",
      "scored": true,
      "scoring_item_id": "WS5_row1",
      "cell_role": "errors"
    },
    {
      "field_id": "WS5_B4",
      "rubric_item_id": "WS5_row1",
      "type": "table_cell",
      "required": true,
      "location_hint": "Printed question 4 — WS5 worksheet response region",
      "printed_blank": 4,
      "scoring_mode": "computed",
      "scored": true,
      "scoring_item_id": "WS5_row1",
      "cell_role": "mcr"
    },
    {
      "field_id": "WS5_B5",
      "rubric_item_id": "WS5_row2",
      "type": "table_cell",
      "required": true,
      "location_hint": "Printed question 5 — WS5 worksheet response region",
      "printed_blank": 5,
      "scoring_mode": "computed",
      "scored": true,
      "scoring_item_id": "WS5_row2",
      "cell_role": "threshold"
    },
    {
      "field_id": "WS5_B6",
      "rubric_item_id": "WS5_row2",
      "type": "table_cell",
      "required": true,
      "location_hint": "Printed question 6 — WS5 worksheet response region",
      "printed_blank": 6,
      "scoring_mode": "computed",
      "scored": true,
      "scoring_item_id": "WS5_row2",
      "cell_role": "correct"
    },
    {
      "field_id": "WS5_B7",
      "rubric_item_id": "WS5_row2",
      "type": "table_cell",
      "required": true,
      "location_hint": "Printed question 7 — WS5 worksheet response region",
      "printed_blank": 7,
      "scoring_mode": "computed",
      "scored": true,
      "scoring_item_id": "WS5_row2",
      "cell_role": "errors"
    },
    {
      "field_id": "WS5_B8",
      "rubric_item_id": "WS5_row2",
      "type": "table_cell",
      "required": true,
      "location_hint": "Printed question 8 — WS5 worksheet response region",
      "printed_blank": 8,
      "scoring_mode": "computed",
      "scored": true,
      "scoring_item_id": "WS5_row2",
      "cell_role": "mcr"
    },
    {
      "field_id": "WS5_B9",
      "rubric_item_id": "WS5_row3",
      "type": "table_cell",
      "required": true,
      "location_hint": "Printed question 9 — WS5 worksheet response region",
      "printed_blank": 9,
      "scoring_mode": "computed",
      "scored": true,
      "scoring_item_id": "WS5_row3",
      "cell_role": "threshold"
    }
  ]
}
