{
  "worksheet": "WS7",
  "curriculum_status": "deployed",
  "pipeline_stage": "extraction_only",
  "interpretation_prohibited": true,
  "ocr_engine": "claude_vision",
  "source_type": "worksheet",
  "note": "Part 1: three path-letter boxes (P1_box1–3). Part 2: if-then rules B1–B3 vs WS6 tree.",
  "fields": [
    {
      "field_id": "WS7_1",
      "rubric_item_id": "WS7_1",
      "type": "path_label",
      "required": true,
      "location_hint": "Printed question 1 — WS7 worksheet response region",
      "printed_blank": 1,
      "scoring_mode": "fixed_exact",
      "scored": true,
      "scoring_item_id": "WS7_1"
    },
    {
      "field_id": "WS7_2",
      "rubric_item_id": "WS7_2",
      "type": "path_label",
      "required": true,
      "location_hint": "Printed question 2 — WS7 worksheet response region",
      "printed_blank": 2,
      "scoring_mode": "fixed_exact",
      "scored": true,
      "scoring_item_id": "WS7_2"
    },
    {
      "field_id": "WS7_3",
      "rubric_item_id": "WS7_3",
      "type": "path_label",
      "required": true,
      "location_hint": "Printed question 3 — WS7 worksheet response region",
      "printed_blank": 3,
      "scoring_mode": "fixed_exact",
      "scored": true,
      "scoring_item_id": "WS7_3"
    },
    {
      "field_id": "WS7_4",
      "rubric_item_id": "WS7_4",
      "type": "path_label",
      "required": true,
      "location_hint": "Printed question 4 — WS7 worksheet response region",
      "printed_blank": 4,
      "scoring_mode": "fixed_exact",
      "scored": true,
      "scoring_item_id": "WS7_4"
    },
    {
      "field_id": "WS7_B1",
      "type": "path_label",
      "required": true,
      "location_hint": "Printed question 1 — WS7 worksheet response region",
      "printed_blank": 1,
      "scoring_mode": "cross_worksheet",
      "scored": true,
      "scoring_item_id": "WS7_B1",
      "depends_on": [
        "WS6"
      ]
    },
    {
      "field_id": "WS7_B2",
      "type": "path_label",
      "required": true,
      "location_hint": "Printed question 2 — WS7 worksheet response region",
      "printed_blank": 2,
      "scoring_mode": "cross_worksheet",
      "scored": true,
      "scoring_item_id": "WS7_B2",
      "depends_on": [
        "WS6"
      ]
    },
    {
      "field_id": "WS7_B3",
      "type": "path_label",
      "required": true,
      "location_hint": "Printed question 3 — WS7 worksheet response region",
      "printed_blank": 3,
      "scoring_mode": "cross_worksheet",
      "scored": true,
      "scoring_item_id": "WS7_B3",
      "depends_on": [
        "WS6"
      ]
    },
    {
      "field_id": "WS7_B4",
      "type": "path_label",
      "required": true,
      "location_hint": "Printed question 4 — WS7 worksheet response region",
      "printed_blank": 4,
      "scoring_mode": "descriptive",
      "scored": false
    },
    {
      "field_id": "WS7_B5",
      "type": "path_label",
      "required": true,
      "location_hint": "Printed question 5 — WS7 worksheet response region",
      "printed_blank": 5,
      "scoring_mode": "descriptive",
      "scored": false
    },
    {
      "field_id": "WS7_B6",
      "type": "path_label",
      "required": true,
      "location_hint": "Printed question 6 — WS7 worksheet response region",
      "printed_blank": 6,
      "scoring_mode": "descriptive",
      "scored": false
    },
    {
      "field_id": "WS7_B7",
      "type": "path_label",
      "required": true,
      "location_hint": "Printed question 7 — WS7 worksheet response region",
      "printed_blank": 7,
      "scoring_mode": "descriptive",
      "scored": false
    },
    {
      "field_id": "WS7_P1_box1",
      "type": "path_label",
      "required": true,
      "location_hint": "Printed question 1 — WS7 worksheet response region",
      "printed_blank": 1,
      "scoring_mode": "fixed_exact",
      "scored": true,
      "scoring_item_id": "WS7_P1_box1",
      "fixed_response": "B"
    },
    {
      "field_id": "WS7_P1_box2",
      "type": "path_label",
      "required": true,
      "location_hint": "Printed question 2 — WS7 worksheet response region",
      "printed_blank": 2,
      "scoring_mode": "fixed_exact",
      "scored": true,
      "scoring_item_id": "WS7_P1_box2",
      "fixed_response": "A"
    },
    {
      "field_id": "WS7_P1_box3",
      "type": "path_label",
      "required": true,
      "location_hint": "Printed question 3 — WS7 worksheet response region",
      "printed_blank": 3,
      "scoring_mode": "fixed_exact",
      "scored": true,
      "scoring_item_id": "WS7_P1_box3",
      "fixed_response": "C"
    }
  ]
}
