{
  "worksheet": "WS14",
  "curriculum_status": "deployed",
  "pipeline_stage": "extraction_only",
  "interpretation_prohibited": true,
  "ocr_engine": "claude_vision",
  "source_type": "worksheet",
  "note": "CODAP Arbor Xeno worksheet — transcribe verbatim. 33 blanks; DTI_01 … DTI_33.",
  "fields": [
    {
      "field_id": "DTI_01",
      "rubric_item_id": "DTI_01",
      "type": "free_text",
      "required": true,
      "location_hint": "WS14 Tablo: Karar Ağacını Okuyalım / Kök düğüm"
    },
    {
      "field_id": "DTI_02",
      "rubric_item_id": "DTI_02",
      "type": "free_text",
      "required": true,
      "location_hint": "WS14 Tablo: Karar Ağacını Okuyalım / Mavi saçlı kutu"
    },
    {
      "field_id": "DTI_03",
      "rubric_item_id": "DTI_03",
      "type": "free_text",
      "required": true,
      "location_hint": "WS14 Tablo: Karar Ağacını Okuyalım / Pembe saçlı kutu"
    },
    {
      "field_id": "DTI_04",
      "rubric_item_id": "DTI_04",
      "type": "free_text",
      "required": true,
      "location_hint": "WS14 Tablo: Karar Ağacını Okuyalım / Etiketleme"
    },
    {
      "field_id": "DTI_05",
      "rubric_item_id": "DTI_05",
      "type": "free_text",
      "required": true,
      "location_hint": "WS14 Tablo: Karar Ağacını Okuyalım / Pembe saçlı (tekrar)"
    },
    {
      "field_id": "DTI_06",
      "rubric_item_id": "DTI_06",
      "type": "free_text",
      "required": true,
      "location_hint": "WS14 Tablo: Karar Ağacını Okuyalım / Ayırıcı mı?"
    },
    {
      "field_id": "DTI_07",
      "rubric_item_id": "DTI_07",
      "type": "free_text",
      "required": true,
      "location_hint": "WS14 Tablo: Karar Ağacını Okuyalım / Yeni vaka tahmini"
    },
    {
      "field_id": "DTI_08",
      "rubric_item_id": "DTI_08",
      "type": "free_text",
      "required": true,
      "location_hint": "WS14 FP vs FN tıbbi tehlike"
    },
    {
      "field_id": "DTI_09",
      "rubric_item_id": "DTI_09",
      "type": "free_text",
      "required": true,
      "location_hint": "WS14 10 yeni hastanın otomatik teşhisi"
    },
    {
      "field_id": "DTI_10",
      "rubric_item_id": "DTI_10",
      "type": "emit_record",
      "required": true,
      "location_hint": "WS14 Tablo / TP sayısı"
    },
    {
      "field_id": "DTI_11",
      "rubric_item_id": "DTI_11",
      "type": "free_text",
      "required": true,
      "location_hint": "WS14 Tablo / TP anlamı"
    },
    {
      "field_id": "DTI_12",
      "rubric_item_id": "DTI_12",
      "type": "emit_record",
      "required": true,
      "location_hint": "WS14 Tablo / TN sayısı"
    },
    {
      "field_id": "DTI_13",
      "rubric_item_id": "DTI_13",
      "type": "free_text",
      "required": true,
      "location_hint": "WS14 Tablo / TN anlamı"
    },
    {
      "field_id": "DTI_14",
      "rubric_item_id": "DTI_14",
      "type": "emit_record",
      "required": true,
      "location_hint": "WS14 Tablo / FP sayısı"
    },
    {
      "field_id": "DTI_15",
      "rubric_item_id": "DTI_15",
      "type": "free_text",
      "required": true,
      "location_hint": "WS14 Tablo / FP anlamı"
    },
    {
      "field_id": "DTI_16",
      "rubric_item_id": "DTI_16",
      "type": "emit_record",
      "required": true,
      "location_hint": "WS14 Tablo / FN sayısı"
    },
    {
      "field_id": "DTI_17",
      "rubric_item_id": "DTI_17",
      "type": "free_text",
      "required": true,
      "location_hint": "WS14 Tablo / FN anlamı"
    },
    {
      "field_id": "DTI_18",
      "rubric_item_id": "DTI_18",
      "type": "emit_record",
      "required": true,
      "location_hint": "WS14 Tablo / N sayısı"
    },
    {
      "field_id": "DTI_19",
      "rubric_item_id": "DTI_19",
      "type": "free_text",
      "required": true,
      "location_hint": "WS14 Tablo / N anlamı"
    },
    {
      "field_id": "DTI_20",
      "rubric_item_id": "DTI_20",
      "type": "emit_record",
      "required": true,
      "location_hint": "WS14 Tablo / Doğruluk hesabı"
    },
    {
      "field_id": "DTI_21",
      "rubric_item_id": "DTI_21",
      "type": "free_text",
      "required": true,
      "location_hint": "WS14 Tablo / Doğruluk yorumu"
    },
    {
      "field_id": "DTI_22",
      "rubric_item_id": "DTI_22",
      "type": "emit_record",
      "required": true,
      "location_hint": "WS14 Tablo / Duyarlılık hesabı"
    },
    {
      "field_id": "DTI_23",
      "rubric_item_id": "DTI_23",
      "type": "free_text",
      "required": true,
      "location_hint": "WS14 Tablo / Duyarlılık yorumu"
    },
    {
      "field_id": "DTI_24",
      "rubric_item_id": "DTI_24",
      "type": "emit_record",
      "required": true,
      "location_hint": "WS14 Tablo / Özgüllük hesabı"
    },
    {
      "field_id": "DTI_25",
      "rubric_item_id": "DTI_25",
      "type": "free_text",
      "required": true,
      "location_hint": "WS14 Tablo / Özgüllük yorumu"
    },
    {
      "field_id": "DTI_26",
      "rubric_item_id": "DTI_26",
      "type": "emit_record",
      "required": true,
      "location_hint": "WS14 Tablo / Kesinlik hesabı"
    },
    {
      "field_id": "DTI_27",
      "rubric_item_id": "DTI_27",
      "type": "free_text",
      "required": true,
      "location_hint": "WS14 Tablo / Kesinlik yorumu"
    },
    {
      "field_id": "DTI_28",
      "rubric_item_id": "DTI_28",
      "type": "free_text",
      "required": true,
      "location_hint": "WS14 Öncelikli metrik"
    },
    {
      "field_id": "DTI_29",
      "rubric_item_id": "DTI_29",
      "type": "free_text",
      "required": true,
      "location_hint": "WS14 Yeni metrik – formül"
    },
    {
      "field_id": "DTI_30",
      "rubric_item_id": "DTI_30",
      "type": "free_text",
      "required": true,
      "location_hint": "WS14 Yeni metrik – ne yakalar"
    },
    {
      "field_id": "DTI_31",
      "rubric_item_id": "DTI_31",
      "type": "free_text",
      "required": true,
      "location_hint": "WS14 Yeni metrik – ne zaman tercih"
    },
    {
      "field_id": "DTI_32",
      "rubric_item_id": "DTI_32",
      "type": "emit_record",
      "required": true,
      "location_hint": "WS14 MCR hesabı"
    },
    {
      "field_id": "DTI_33",
      "rubric_item_id": "DTI_33",
      "type": "free_text",
      "required": true,
      "location_hint": "WS14 MCR yorumu"
    }
  ]
}
