{
  "worksheet": "WS10",
  "curriculum_status": "deployed",
  "pipeline_stage": "extraction_only",
  "interpretation_prohibited": true,
  "ocr_engine": "claude_vision",
  "source_type": "worksheet",
  "note": "Seven table misclassification counts (B1–B7) + optimum threshold blank (B8).",
  "fields": [
    {
      "field_id": "WS10_B1",
      "rubric_item_id": "WS10_B1",
      "type": "numeric",
      "required": true,
      "location_hint": "Printed question 1 — WS10 worksheet response region",
      "printed_blank": 1,
      "scoring_mode": "fixed_exact",
      "scored": true,
      "scoring_item_id": "WS10_B1",
      "fixed_response": 4
    },
    {
      "field_id": "WS10_B2",
      "rubric_item_id": "WS10_B2",
      "type": "numeric",
      "required": true,
      "location_hint": "Printed question 2 — WS10 worksheet response region",
      "printed_blank": 2,
      "scoring_mode": "fixed_exact",
      "scored": true,
      "scoring_item_id": "WS10_B2",
      "fixed_response": 3
    },
    {
      "field_id": "WS10_B3",
      "rubric_item_id": "WS10_B3",
      "type": "numeric",
      "required": true,
      "location_hint": "Printed question 3 — WS10 worksheet response region",
      "printed_blank": 3,
      "scoring_mode": "fixed_exact",
      "scored": true,
      "scoring_item_id": "WS10_B3",
      "fixed_response": 2
    },
    {
      "field_id": "WS10_B4",
      "rubric_item_id": "WS10_B4",
      "type": "numeric",
      "required": true,
      "location_hint": "Printed question 4 — WS10 worksheet response region",
      "printed_blank": 4,
      "scoring_mode": "fixed_exact",
      "scored": true,
      "scoring_item_id": "WS10_B4",
      "fixed_response": 3
    },
    {
      "field_id": "WS10_B5",
      "rubric_item_id": "WS10_B5",
      "type": "numeric",
      "required": true,
      "location_hint": "Printed question 5 — WS10 worksheet response region",
      "printed_blank": 5,
      "scoring_mode": "fixed_exact",
      "scored": true,
      "scoring_item_id": "WS10_B5",
      "fixed_response": 2
    },
    {
      "field_id": "WS10_B6",
      "rubric_item_id": "WS10_B6",
      "type": "numeric",
      "required": true,
      "location_hint": "Printed question 6 — WS10 worksheet response region",
      "printed_blank": 6,
      "scoring_mode": "fixed_exact",
      "scored": true,
      "scoring_item_id": "WS10_B6",
      "fixed_response": 1
    },
    {
      "field_id": "WS10_B7",
      "rubric_item_id": "WS10_B7",
      "type": "numeric",
      "required": true,
      "location_hint": "Printed question 7 — WS10 worksheet response region",
      "printed_blank": 7,
      "scoring_mode": "fixed_exact",
      "scored": true,
      "scoring_item_id": "WS10_B7",
      "fixed_response": 2
    },
    {
      "field_id": "WS10_B8",
      "rubric_item_id": "WS10_B8",
      "type": "numeric",
      "required": true,
      "location_hint": "Printed question 8 — WS10 worksheet response region",
      "printed_blank": 8,
      "scoring_mode": "fixed_exact",
      "scored": true,
      "scoring_item_id": "WS10_B8",
      "fixed_response": 408
    }
  ]
}
