{
  "worksheet": "WS11",
  "curriculum_status": "deployed",
  "pipeline_stage": "extraction_only",
  "interpretation_prohibited": true,
  "ocr_engine": "claude_vision",
  "source_type": "worksheet",
  "note": "Mixed reflection, cognitive, and descriptive fields; score only cognitive subset.",
  "fields": [
    {
      "field_id": "WS11_B1",
      "type": "free_text",
      "required": true,
      "location_hint": "WS11 worksheet response region"
    },
    {
      "field_id": "WS11_B2",
      "type": "free_text",
      "required": true,
      "location_hint": "WS11 worksheet response region"
    },
    {
      "field_id": "WS11_B3",
      "type": "free_text",
      "required": true,
      "location_hint": "WS11 worksheet response region"
    },
    {
      "field_id": "WS11_B4",
      "type": "free_text",
      "required": true,
      "location_hint": "WS11 worksheet response region"
    },
    {
      "field_id": "WS11_B5",
      "type": "free_text",
      "required": true,
      "location_hint": "WS11 worksheet response region"
    },
    {
      "field_id": "WS11_B6",
      "type": "free_text",
      "required": true,
      "location_hint": "WS11 worksheet response region"
    },
    {
      "field_id": "WS11_B7",
      "type": "free_text",
      "required": true,
      "location_hint": "WS11 worksheet response region"
    },
    {
      "field_id": "WS11_B8a",
      "rubric_item_id": "WS11_B8a",
      "type": "free_text",
      "required": true,
      "location_hint": "WS11 worksheet response region"
    },
    {
      "field_id": "WS11_B8b",
      "rubric_item_id": "WS11_B8b",
      "type": "free_text",
      "required": true,
      "location_hint": "WS11 worksheet response region"
    },
    {
      "field_id": "WS11_B9",
      "rubric_item_id": "WS11_B9",
      "type": "free_text",
      "required": true,
      "location_hint": "WS11 worksheet response region"
    },
    {
      "field_id": "WS11_L10_1",
      "type": "free_text",
      "required": false,
      "location_hint": "WS11 worksheet response region",
      "note": "Descriptive-only field"
    },
    {
      "field_id": "WS11_L10_2",
      "type": "free_text",
      "required": false,
      "location_hint": "WS11 worksheet response region",
      "note": "Descriptive-only field"
    },
    {
      "field_id": "WS11_L10_3",
      "type": "free_text",
      "required": false,
      "location_hint": "WS11 worksheet response region",
      "note": "Descriptive-only field"
    },
    {
      "field_id": "WS11_L10_4",
      "type": "free_text",
      "required": false,
      "location_hint": "WS11 worksheet response region",
      "note": "Descriptive-only field"
    },
    {
      "field_id": "WS11_L10_5",
      "type": "free_text",
      "required": false,
      "location_hint": "WS11 worksheet response region",
      "note": "Descriptive-only field"
    },
    {
      "field_id": "WS11_L10_6",
      "type": "free_text",
      "required": false,
      "location_hint": "WS11 worksheet response region",
      "note": "Descriptive-only field"
    },
    {
      "field_id": "WS11_L10_7",
      "type": "free_text",
      "required": false,
      "location_hint": "WS11 worksheet response region",
      "note": "Descriptive-only field"
    },
    {
      "field_id": "WS11_L10_8",
      "type": "free_text",
      "required": false,
      "location_hint": "WS11 worksheet response region",
      "note": "Descriptive-only field"
    },
    {
      "field_id": "WS11_L11_1",
      "type": "free_text",
      "required": false,
      "location_hint": "WS11 worksheet response region",
      "note": "Descriptive-only field"
    },
    {
      "field_id": "WS11_L11_2",
      "type": "free_text",
      "required": false,
      "location_hint": "WS11 worksheet response region",
      "note": "Descriptive-only field"
    },
    {
      "field_id": "WS11_L11_3",
      "type": "free_text",
      "required": false,
      "location_hint": "WS11 worksheet response region",
      "note": "Descriptive-only field"
    },
    {
      "field_id": "WS11_L12_1",
      "type": "free_text",
      "required": false,
      "location_hint": "WS11 worksheet response region",
      "note": "Descriptive-only field"
    },
    {
      "field_id": "WS11_L12_2",
      "type": "free_text",
      "required": false,
      "location_hint": "WS11 worksheet response region",
      "note": "Descriptive-only field"
    },
    {
      "field_id": "WS11_L12_3",
      "type": "free_text",
      "required": false,
      "location_hint": "WS11 worksheet response region",
      "note": "Descriptive-only field"
    },
    {
      "field_id": "WS11_L12_4",
      "type": "free_text",
      "required": false,
      "location_hint": "WS11 worksheet response region",
      "note": "Descriptive-only field"
    },
    {
      "field_id": "WS11_L12_5",
      "type": "free_text",
      "required": false,
      "location_hint": "WS11 worksheet response region",
      "note": "Descriptive-only field"
    },
    {
      "field_id": "WS11_Q10_1",
      "rubric_item_id": "WS11_Q10_1",
      "type": "boolean",
      "required": true,
      "location_hint": "WS11 worksheet response region"
    },
    {
      "field_id": "WS11_Q10_2",
      "rubric_item_id": "WS11_Q10_2",
      "type": "boolean",
      "required": true,
      "location_hint": "WS11 worksheet response region"
    },
    {
      "field_id": "WS11_Q10_3",
      "rubric_item_id": "WS11_Q10_3",
      "type": "boolean",
      "required": true,
      "location_hint": "WS11 worksheet response region"
    },
    {
      "field_id": "WS11_Q10_4",
      "rubric_item_id": "WS11_Q10_4",
      "type": "boolean",
      "required": true,
      "location_hint": "WS11 worksheet response region"
    },
    {
      "field_id": "WS11_Q10_5",
      "rubric_item_id": "WS11_Q10_5",
      "type": "boolean",
      "required": true,
      "location_hint": "WS11 worksheet response region"
    },
    {
      "field_id": "WS11_Q10_6",
      "rubric_item_id": "WS11_Q10_6",
      "type": "boolean",
      "required": true,
      "location_hint": "WS11 worksheet response region"
    },
    {
      "field_id": "WS11_Q10_7",
      "rubric_item_id": "WS11_Q10_7",
      "type": "boolean",
      "required": true,
      "location_hint": "WS11 worksheet response region"
    },
    {
      "field_id": "WS11_Q10_8",
      "rubric_item_id": "WS11_Q10_8",
      "type": "boolean",
      "required": true,
      "location_hint": "WS11 worksheet response region"
    },
    {
      "field_id": "WS11_Q11_2",
      "rubric_item_id": "WS11_Q11_2",
      "type": "boolean",
      "required": true,
      "location_hint": "WS11 worksheet response region"
    },
    {
      "field_id": "WS11_Q11_3",
      "rubric_item_id": "WS11_Q11_3",
      "type": "boolean",
      "required": true,
      "location_hint": "WS11 worksheet response region"
    },
    {
      "field_id": "WS11_Q11_4",
      "rubric_item_id": "WS11_Q11_4",
      "type": "boolean",
      "required": true,
      "location_hint": "WS11 worksheet response region"
    },
    {
      "field_id": "WS11_Q12_1",
      "rubric_item_id": "WS11_Q12_1",
      "type": "boolean",
      "required": true,
      "location_hint": "WS11 worksheet response region"
    },
    {
      "field_id": "WS11_Q12_2",
      "rubric_item_id": "WS11_Q12_2",
      "type": "boolean",
      "required": true,
      "location_hint": "WS11 worksheet response region"
    },
    {
      "field_id": "WS11_Q12_3",
      "rubric_item_id": "WS11_Q12_3",
      "type": "boolean",
      "required": true,
      "location_hint": "WS11 worksheet response region"
    },
    {
      "field_id": "WS11_Q12_4",
      "rubric_item_id": "WS11_Q12_4",
      "type": "boolean",
      "required": true,
      "location_hint": "WS11 worksheet response region"
    },
    {
      "field_id": "WS11_Q12_5",
      "rubric_item_id": "WS11_Q12_5",
      "type": "boolean",
      "required": true,
      "location_hint": "WS11 worksheet response region"
    }
  ]
}
