{
  "worksheet": "WS3",
  "curriculum_status": "deployed",
  "pipeline_stage": "extraction_only",
  "interpretation_prohibited": true,
  "ocr_engine": "claude_vision",
  "source_type": "worksheet",
  "note": "Eight response fields; B7/B8 are threshold expressions.",
  "fields": [
    {
      "field_id": "WS3_B1",
      "rubric_item_id": "WS3_B1",
      "type": "free_text",
      "required": true,
      "location_hint": "WS3 worksheet response region"
    },
    {
      "field_id": "WS3_B2",
      "rubric_item_id": "WS3_B2",
      "type": "free_text",
      "required": true,
      "location_hint": "WS3 worksheet response region"
    },
    {
      "field_id": "WS3_B3",
      "rubric_item_id": "WS3_B3",
      "type": "free_text",
      "required": true,
      "location_hint": "WS3 worksheet response region"
    },
    {
      "field_id": "WS3_B4",
      "rubric_item_id": "WS3_B4",
      "type": "free_text",
      "required": true,
      "location_hint": "WS3 worksheet response region"
    },
    {
      "field_id": "WS3_B5",
      "rubric_item_id": "WS3_B5",
      "type": "free_text",
      "required": true,
      "location_hint": "WS3 worksheet response region"
    },
    {
      "field_id": "WS3_B6",
      "rubric_item_id": "WS3_B6",
      "type": "free_text",
      "required": true,
      "location_hint": "WS3 worksheet response region"
    },
    {
      "field_id": "WS3_B7",
      "rubric_item_id": "WS3_B7",
      "type": "free_text",
      "required": true,
      "location_hint": "WS3 worksheet response region"
    },
    {
      "field_id": "WS3_B8",
      "rubric_item_id": "WS3_B8",
      "type": "free_text",
      "required": true,
      "location_hint": "WS3 worksheet response region"
    }
  ]
}
