{
  "worksheet": "WS1",
  "curriculum_status": "deployed",
  "pipeline_stage": "extraction_only",
  "interpretation_prohibited": true,
  "ocr_engine": "claude_vision",
  "source_type": "worksheet",
  "note": "Seven fill-in-the-blank fields on the nutrition label (WS1_B1–B7; printed blanks 5–11).",
  "fields": [
    {
      "field_id": "WS1_B1",
      "rubric_item_id": "WS1_B1",
      "type": "free_text",
      "required": true,
      "location_hint": "WS1 worksheet response region"
    },
    {
      "field_id": "WS1_B2",
      "rubric_item_id": "WS1_B2",
      "type": "free_text",
      "required": true,
      "location_hint": "WS1 worksheet response region"
    },
    {
      "field_id": "WS1_B3",
      "rubric_item_id": "WS1_B3",
      "type": "free_text",
      "required": true,
      "location_hint": "WS1 worksheet response region"
    },
    {
      "field_id": "WS1_B4",
      "rubric_item_id": "WS1_B4",
      "type": "free_text",
      "required": true,
      "location_hint": "WS1 worksheet response region"
    },
    {
      "field_id": "WS1_B5",
      "rubric_item_id": "WS1_B5",
      "type": "free_text",
      "required": true,
      "location_hint": "WS1 worksheet response region"
    },
    {
      "field_id": "WS1_B6",
      "rubric_item_id": "WS1_B6",
      "type": "free_text",
      "required": true,
      "location_hint": "WS1 worksheet response region"
    },
    {
      "field_id": "WS1_B7",
      "rubric_item_id": "WS1_B7",
      "type": "free_text",
      "required": true,
      "location_hint": "WS1 worksheet response region"
    }
  ]
}
