{
  "worksheet": "WS6",
  "curriculum_status": "deployed",
  "pipeline_stage": "extraction_only",
  "interpretation_prohibited": true,
  "ocr_engine": "claude_vision",
  "source_type": "worksheet",
  "note": "Thirteen structured tree fields (WS6_B1–B13).",
  "fields": [
    {
      "field_id": "WS6_B1",
      "rubric_item_id": "WS6_root_feature",
      "type": "structured",
      "required": true,
      "location_hint": "Printed question 1 — WS6 worksheet response region",
      "printed_blank": 1,
      "scoring_mode": "computed",
      "scored": true,
      "scoring_item_id": "WS6_root_feature"
    },
    {
      "field_id": "WS6_B10",
      "rubric_item_id": "WS6_leaves",
      "type": "structured",
      "required": true,
      "location_hint": "Printed question 10 — WS6 worksheet response region",
      "printed_blank": 10,
      "scoring_mode": "computed",
      "scored": true,
      "scoring_item_id": "WS6_leaves"
    },
    {
      "field_id": "WS6_B11",
      "rubric_item_id": "WS6_leaves",
      "type": "structured",
      "required": true,
      "location_hint": "Printed question 11 — WS6 worksheet response region",
      "printed_blank": 11,
      "scoring_mode": "computed",
      "scored": true,
      "scoring_item_id": "WS6_leaves"
    },
    {
      "field_id": "WS6_B12",
      "rubric_item_id": "WS6_leaves",
      "type": "structured",
      "required": true,
      "location_hint": "Printed question 12 — WS6 worksheet response region",
      "printed_blank": 12,
      "scoring_mode": "computed",
      "scored": true,
      "scoring_item_id": "WS6_leaves"
    },
    {
      "field_id": "WS6_B13",
      "rubric_item_id": "WS6_leaves",
      "type": "structured",
      "required": true,
      "location_hint": "Printed question 13 — WS6 worksheet response region",
      "printed_blank": 13,
      "scoring_mode": "computed",
      "scored": true,
      "scoring_item_id": "WS6_leaves"
    },
    {
      "field_id": "WS6_B2",
      "rubric_item_id": "WS6_root_threshold",
      "type": "structured",
      "required": true,
      "location_hint": "Printed question 2 — WS6 worksheet response region",
      "printed_blank": 2,
      "scoring_mode": "computed",
      "scored": true,
      "scoring_item_id": "WS6_root_threshold"
    },
    {
      "field_id": "WS6_B3",
      "rubric_item_id": "WS6_root_labels",
      "type": "structured",
      "required": true,
      "location_hint": "Printed question 3 — WS6 worksheet response region",
      "printed_blank": 3,
      "scoring_mode": "computed",
      "scored": true,
      "scoring_item_id": "WS6_root_labels"
    },
    {
      "field_id": "WS6_B4",
      "rubric_item_id": "WS6_root_labels",
      "type": "structured",
      "required": true,
      "location_hint": "Printed question 4 — WS6 worksheet response region",
      "printed_blank": 4,
      "scoring_mode": "computed",
      "scored": true,
      "scoring_item_id": "WS6_root_labels"
    },
    {
      "field_id": "WS6_B5",
      "rubric_item_id": "WS6_leaves",
      "type": "structured",
      "required": true,
      "location_hint": "Printed question 5 — WS6 worksheet response region",
      "printed_blank": 5,
      "scoring_mode": "computed",
      "scored": true,
      "scoring_item_id": "WS6_leaves"
    },
    {
      "field_id": "WS6_B6",
      "rubric_item_id": "WS6_inner_feature",
      "type": "structured",
      "required": true,
      "location_hint": "Printed question 6 — WS6 worksheet response region",
      "printed_blank": 6,
      "scoring_mode": "computed",
      "scored": true,
      "scoring_item_id": "WS6_inner_feature"
    },
    {
      "field_id": "WS6_B7",
      "rubric_item_id": "WS6_inner_threshold",
      "type": "structured",
      "required": true,
      "location_hint": "Printed question 7 — WS6 worksheet response region",
      "printed_blank": 7,
      "scoring_mode": "computed",
      "scored": true,
      "scoring_item_id": "WS6_inner_threshold"
    },
    {
      "field_id": "WS6_B8",
      "rubric_item_id": "WS6_inner_labels",
      "type": "structured",
      "required": true,
      "location_hint": "Printed question 8 — WS6 worksheet response region",
      "printed_blank": 8,
      "scoring_mode": "computed",
      "scored": true,
      "scoring_item_id": "WS6_inner_labels"
    },
    {
      "field_id": "WS6_B9",
      "rubric_item_id": "WS6_inner_labels",
      "type": "structured",
      "required": true,
      "location_hint": "Printed question 9 — WS6 worksheet response region",
      "printed_blank": 9,
      "scoring_mode": "computed",
      "scored": true,
      "scoring_item_id": "WS6_inner_labels"
    }
  ]
}
