{
  "worksheet": "WS_DT",
  "curriculum_status": "deployed",
  "pipeline_stage": "extraction_only",
  "interpretation_prohibited": true,
  "ocr_engine": "claude_vision",
  "source_type": "worksheet",
  "note": "CODAP Arbor worksheet DT — transcribe pre-service teacher text and EMIT fields verbatim. Sections A–G; item IDs DT_A_Q1 … DT_G_Q2. EMIT records (B_Q1–Q3, C_Q1, D_Q1, F_Q1): capture variable, threshold with operator (≤/≥/</>), and TP/FP/TN/FN exactly as printed. Operator complement rule aligns with unplugged WS5/WS6 (≤↔>, <↔≥, ≥↔<, >↔≤).",
  "fields": [
    {
      "field_id": "DT_A_Q1",
      "rubric_item_id": "DT_A_Q1",
      "type": "free_text",
      "required": true,
      "location_hint": "WS_DT section field"
    },
    {
      "field_id": "DT_A_Q2",
      "rubric_item_id": "DT_A_Q2",
      "type": "free_text",
      "required": true,
      "location_hint": "WS_DT section field"
    },
    {
      "field_id": "DT_A_Q3",
      "rubric_item_id": "DT_A_Q3",
      "type": "free_text",
      "required": true,
      "location_hint": "WS_DT section field"
    },
    {
      "field_id": "DT_A_Q4",
      "rubric_item_id": "DT_A_Q4",
      "type": "free_text",
      "required": true,
      "location_hint": "WS_DT section field"
    },
    {
      "field_id": "DT_B_Q1",
      "rubric_item_id": "DT_B_Q1",
      "type": "emit_record",
      "required": true,
      "location_hint": "WS_DT section field"
    },
    {
      "field_id": "DT_B_Q2",
      "rubric_item_id": "DT_B_Q2",
      "type": "emit_record",
      "required": true,
      "location_hint": "WS_DT section field"
    },
    {
      "field_id": "DT_B_Q3",
      "rubric_item_id": "DT_B_Q3",
      "type": "emit_record",
      "required": true,
      "location_hint": "WS_DT section field"
    },
    {
      "field_id": "DT_B_Q4",
      "rubric_item_id": "DT_B_Q4",
      "type": "free_text",
      "required": true,
      "location_hint": "WS_DT section field"
    },
    {
      "field_id": "DT_C_Q1",
      "rubric_item_id": "DT_C_Q1",
      "type": "emit_record",
      "required": true,
      "location_hint": "WS_DT section field"
    },
    {
      "field_id": "DT_C_Q2",
      "rubric_item_id": "DT_C_Q2",
      "type": "free_text",
      "required": true,
      "location_hint": "WS_DT section field"
    },
    {
      "field_id": "DT_C_Q3",
      "rubric_item_id": "DT_C_Q3",
      "type": "free_text",
      "required": true,
      "location_hint": "WS_DT section field"
    },
    {
      "field_id": "DT_D_Q1",
      "rubric_item_id": "DT_D_Q1",
      "type": "emit_record",
      "required": true,
      "location_hint": "WS_DT section field"
    },
    {
      "field_id": "DT_D_Q2",
      "rubric_item_id": "DT_D_Q2",
      "type": "free_text",
      "required": true,
      "location_hint": "WS_DT section field"
    },
    {
      "field_id": "DT_D_Q3",
      "rubric_item_id": "DT_D_Q3",
      "type": "free_text",
      "required": true,
      "location_hint": "WS_DT section field"
    },
    {
      "field_id": "DT_D_Q4",
      "rubric_item_id": "DT_D_Q4",
      "type": "free_text",
      "required": true,
      "location_hint": "WS_DT section field"
    },
    {
      "field_id": "DT_E_TP",
      "rubric_item_id": "DT_E_TP",
      "type": "free_text",
      "required": true,
      "location_hint": "WS_DT section field"
    },
    {
      "field_id": "DT_E_FP",
      "rubric_item_id": "DT_E_FP",
      "type": "free_text",
      "required": true,
      "location_hint": "WS_DT section field"
    },
    {
      "field_id": "DT_E_sensitivity_formula",
      "rubric_item_id": "DT_E_sensitivity_formula",
      "type": "free_text",
      "required": true,
      "location_hint": "WS_DT section field"
    },
    {
      "field_id": "DT_E_MCR_formula",
      "rubric_item_id": "DT_E_MCR_formula",
      "type": "free_text",
      "required": true,
      "location_hint": "WS_DT section field"
    },
    {
      "field_id": "DT_E_sensitivity",
      "rubric_item_id": "DT_E_sensitivity",
      "type": "free_text",
      "required": true,
      "location_hint": "WS_DT section field"
    },
    {
      "field_id": "DT_E_MCR",
      "rubric_item_id": "DT_E_MCR",
      "type": "free_text",
      "required": true,
      "location_hint": "WS_DT section field"
    },
    {
      "field_id": "DT_E_Q1",
      "rubric_item_id": "DT_E_Q1",
      "type": "free_text",
      "required": true,
      "location_hint": "WS_DT section field"
    },
    {
      "field_id": "DT_E_Q2",
      "rubric_item_id": "DT_E_Q2",
      "type": "free_text",
      "required": true,
      "location_hint": "WS_DT section field"
    },
    {
      "field_id": "DT_E_Q3",
      "rubric_item_id": "DT_E_Q3",
      "type": "free_text",
      "required": true,
      "location_hint": "WS_DT section field"
    },
    {
      "field_id": "DT_E_Q4",
      "rubric_item_id": "DT_E_Q4",
      "type": "free_text",
      "required": true,
      "location_hint": "WS_DT section field"
    },
    {
      "field_id": "DT_F_Q1",
      "rubric_item_id": "DT_F_Q1",
      "type": "emit_record",
      "required": true,
      "location_hint": "WS_DT section field"
    },
    {
      "field_id": "DT_F_Q2",
      "rubric_item_id": "DT_F_Q2",
      "type": "free_text",
      "required": true,
      "location_hint": "WS_DT section field"
    },
    {
      "field_id": "DT_G_overfitting",
      "rubric_item_id": "DT_G_overfitting",
      "type": "free_text",
      "required": true,
      "location_hint": "WS_DT section field"
    },
    {
      "field_id": "DT_G_DT_definition",
      "rubric_item_id": "DT_G_DT_definition",
      "type": "free_text",
      "required": true,
      "location_hint": "WS_DT section field"
    },
    {
      "field_id": "DT_G_Q1",
      "rubric_item_id": "DT_G_Q1",
      "type": "free_text",
      "required": true,
      "location_hint": "WS_DT section field"
    },
    {
      "field_id": "DT_G_Q2",
      "rubric_item_id": "DT_G_Q2",
      "type": "free_text",
      "required": true,
      "location_hint": "WS_DT section field"
    }
  ]
}
